<?xml version="1.0" encoding="UTF-8"?>
<xs:schema xmlns:xs="http://www.w3.org/2001/XMLSchema">
  <xs:complexType name="OptionType">
    <xs:sequence>
      <xs:element name="Name" type="xs:string" />
      <xs:element name="Description" type="xs:string" />
      <xs:element name="DefaultValue" type="xs:anySimpleType" minOccurs="0" maxOccurs="1" />
    </xs:sequence>
    <xs:attribute name="Mandatory"
    type="xs:boolean"
    use="optional" />
    <xs:attribute name="Private"
    type="xs:boolean"
    use="optional" />
  </xs:complexType>
  <xs:complexType name="OptionTypeString">
    <xs:complexContent>
      <xs:restriction base="OptionType">
        <xs:sequence>
          <xs:element name="Name" type="xs:string" />
          <xs:element name="Description" type="xs:string" />
          <xs:element name="DefaultValue" type="xs:string" minOccurs="0" maxOccurs="1" />
        </xs:sequence>
        <xs:attribute name="Mandatory"
        type="xs:boolean"
        use="optional" />
        <xs:attribute name="Private"
        type="xs:boolean"
        use="optional" />
      </xs:restriction>
    </xs:complexContent>
  </xs:complexType>
  <xs:complexType name="OptionTypeBool">
    <xs:complexContent>
      <xs:restriction base="OptionType">
        <xs:sequence>
          <xs:element name="Name" type="xs:string" />
          <xs:element name="Description" type="xs:string" />
          <xs:element name="DefaultValue" type="xs:boolean" minOccurs="0" maxOccurs="1" />
        </xs:sequence>
        <xs:attribute name="Mandatory"
        type="xs:boolean"
        use="optional" />
        <xs:attribute name="Private"
        type="xs:boolean"
        use="optional" />
      </xs:restriction>
    </xs:complexContent>
  </xs:complexType>


  <xs:element name="PenmuxModule">
    <xs:complexType>
      <xs:sequence>
        <xs:element name="Name" type="xs:string" />
        <xs:element name="Description" type="xs:string" />
        <xs:element name="Command" type="xs:string" minOccurs="0" maxOccurs="1" />
        <xs:element name="HandleScript" type="xs:string" minOccurs="0" maxOccurs="1" />
        <xs:element name="Use" type="xs:string" minOccurs="0" maxOccurs="unbounded" />
        <xs:element name="Depend" type="xs:string" minOccurs="0" maxOccurs="unbounded" />
        <xs:element name="Option" type="OptionType" minOccurs="0" maxOccurs="unbounded" />
      </xs:sequence>
    </xs:complexType>
  </xs:element>
</xs:schema>
