<?xml version="1.0" encoding="UTF-8"?>
<PenmuxModule xmlns:xsi="http://www.w3.org/2001/XMLSchema-instance" xsi:noNamespaceSchemaLocation="../../schemas/penmux-module.xsd">
  <Name>Snipper</Name>
  <Description>Snipper module that reads in csv files that have different useful snippets. Will be copied into clipboard</Description>
  <HasRun>true</HasRun>
  <Option xsi:type="OptionTypeString" Private="true" Exported="true">
    <Name>SnippetSearchPath</Name>
    <Description>Path that contains CSV files that holds the snippets</Description>
  </Option>
  <Option xsi:type="OptionTypeString" Private="true" Exported="true">
    <Name>ClipboardCommand</Name>
    <Description>Command used for copying snippet to clipboard</Description>
  </Option>
  <Option xsi:type="OptionTypeString">
    <Name>LocalHost</Name>
    <Description>Defines the local host</Description>
  </Option>
  <Option xsi:type="OptionTypeInt">
    <Name>LocalPort</Name>
    <Description>Defines the local port</Description>
  </Option>
  <Consumes NoNotify="true">
    <Name>HttpUri</Name>
    <From>HttpExchange</From>
  </Consumes>
</PenmuxModule>
