<?xml version="1.0" encoding="UTF-8"?>
<PenmuxModule xmlns:xsi="http://www.w3.org/2001/XMLSchema-instance" xsi:noNamespaceSchemaLocation="../../schemas/penmux-module.xsd">
  <Name>Session</Name>
  <Description>Module to persist penmux sessions and provide easy to use storage of module options</Description>
  <CmdPrio>100</CmdPrio>
  <NotifyOptions>true</NotifyOptions>
  <Option xsi:type="OptionTypeBool" Private="true" Exported="true">
    <Name>AutoLoad</Name>
    <Description>If enabled sessions will be loaded automatically after cd into a directory that includes a session file</Description>
  </Option>
  <Option xsi:type="OptionTypeBool" Private="true" Exported="true">
    <Name>AutoSave</Name>
    <Description>If enabled sessions will be saved automatically after change of module options</Description>
  </Option>
  <Option xsi:type="OptionTypeBool" Private="true" Exported="true">
    <Name>NoConfirm</Name>
    <Description>If enabled creating a new session that points to a existing one will overwrite the session file without confirmation</Description>
  </Option>
  <Option xsi:type="OptionTypeBool" Private="true" Exported="true">
    <Name>UseCwd</Name>
    <Description>If enabled new session will be created as sub directory to the current dir</Description>
  </Option>
  <Option xsi:type="OptionTypeString" Private="true" Exported="true">
    <Name>SessionDirBase</Name>
    <Description>Default directory to use for sessions. Has no effect when UseCwd is set to true.</Description>
  </Option>
  <Option xsi:type="OptionTypeString" Provided="true">
    <Name>SessionName</Name>
    <Description>Session name.</Description>
  </Option>
  <Option xsi:type="OptionTypeString" Provided="true">
    <Name>SessionDir</Name>
    <Description>Final Session directory.</Description>
  </Option>
</PenmuxModule>
