<?xml version="1.0" encoding="UTF-8"?>
<PenmuxModule xmlns:xsi="http://www.w3.org/2001/XMLSchema-instance" xsi:noNamespaceSchemaLocation="../../schemas/penmux-module.xsd">
  <Name>Commander</Name>
  <Description>Command launcher module that reads in csv files that have different commands predefined</Description>
  <HasRun>true</HasRun>
  <HandleScript>auxiliary/commander/module.sh</HandleScript>
  <Option xsi:type="OptionTypeString" Private="true" Exported="true">
    <Name>CommandSearchPath</Name>
    <Description>Path that contains CSV files that holds the command definitions</Description>
  </Option>
  <Option xsi:type="OptionTypeBool" Private="true" Exported="true">
    <Name>NoConfirm</Name>
    <Description>Start the command after selection. When enabled you can't edit the command before running</Description>
  </Option>
  <Option xsi:type="OptionTypeString">
    <Name>RemoteHost</Name>
    <Description>Defines the remote host(s)</Description>
  </Option>
  <Option xsi:type="OptionTypeInt">
    <Name>RemotePort</Name>
    <Description>Defines the remote port</Description>
  </Option>
  <Option xsi:type="OptionTypeString">
    <Name>RemoteProto</Name>
    <Description>Defines the default remote protocol</Description>
  </Option>
  <Option xsi:type="OptionTypeString">
    <Name>LocalHost</Name>
    <Description>Defines the local host</Description>
  </Option>
  <Option xsi:type="OptionTypeInt">
    <Name>LocalPort</Name>
    <Description>Defines the local port</Description>
  </Option>
  <Option xsi:type="OptionTypeInt" Private="true" Exported="true">
    <Name>LocalTempPort</Name>
    <Description>Defines a local port to be used for temporary internal tasks</Description>
  </Option>
   <Consumes NoNotify="true">
    <Name>SessionDir</Name>
    <Description>The final session directory. Can be used by other modules to store data.</Description>
  </Consumes>
  <Consumes NoNotify="true">
    <Name>HttpRootDir</Name>
    <Description>Provides the final http server root directory which holds the files. Can be used by other modules to store files</Description>
  </Consumes>
</PenmuxModule>
